{
  "schema_version": 1,
  "package_version": "0.2.0",
  "id": "mpyy-asgari-standartlar",
  "source": "Mekânsal Planlar Yapım Yönetmeliği (MPYY), EK-2 FARKLI NÜFUS GRUPLARINDA ASGARİ SOSYAL VE TEKNİK ALTYAPI ALANLARINA İLİŞKİN STANDARTLAR VE ASGARİ ALAN BÜYÜKLÜKLERİ TABLOSU (RG-17/5/2017-30069)",
  "published": "2017-05-17",
  "licence": "resmi-mevzuat-metni",
  "aciklama": "MPYY EK-2 tablosu: nüfus gruplarına göre asgari sosyal ve teknik altyapı alanı standartları. TAKS/KAKS komşusu mevzuat değerleridir ve C++'a giremez (CLAUDE.md 5.13). m²/kişi değerleri binde tam sayı olarak saklanır (0.5 -> 500); kayan nokta saklanmaz.",
  "kapsam": {
    "durum": "tablo-cikarildi-uzman-onayi-bekliyor",
    "iceren": [
      "33 altyapı kalemi, 4 nüfus grubu.",
      "Kaynak metin her değerin yanında ('m2_kisi_metin', 'asgari_alan_metin') saklanır; çevrilmiş değer denetlenebilir.",
      "Tablonun 13 maddelik açıklama bloğu birebir."
    ],
    "eksikler": [
      "'Ünit başına (110) m²', 'Yatak başına (130) m²' gibi birim bağımlı hücreler sayıya çevrilmemiştir; ham metin olarak durur ve satır 'belirsiz' işaretlidir.",
      "Kaynak tabloda '150.001 - 500.000' ile '501.000 +' grupları arasında 500.001-500.999 aralığı tanımsızdır. Bu kaynağın kendi yazımıdır, düzeltilmemiştir.",
      "'belirsiz' işaretli 6 kalem vardır."
    ],
    "onay": "BEKLİYOR",
    "sonraki_surum": "0.3.0 — birim bağımlı hücrelerin uzman onaylı çevirisi."
  },
  "nufus_gruplari": [
    {
      "id": "nufus-0-75-000",
      "etiket": "0 - 75.000"
    },
    {
      "id": "nufus-75-001-150-000",
      "etiket": "75.001- 150.000"
    },
    {
      "id": "nufus-150-001-500-000",
      "etiket": "150.001 - 500.000"
    },
    {
      "id": "nufus-501-000",
      "etiket": "501.000 +"
    }
  ],
  "kalemler": [
    {
      "id": "ek2-anaokulu",
      "ad": "Anaokulu",
      "kaynak": "Mekânsal Planlar Yapım Yönetmeliği (MPYY), EK-2 (RG-17/5/2017-30069)",
      "ust_grup": "EĞİTİM TESİSLERİ ALANI",
      "satir": 5,
      "degerler": [
        {
          "nufus_grubu": "nufus-0-75-000",
          "m2_kisi_metin": "0.5",
          "m2_kisi_binde": 500,
          "asgari_alan_metin": "1.500-3.000",
          "asgari_alan_m2_en_az": 1500,
          "asgari_alan_m2_en_cok": 3000
        },
        {
          "nufus_grubu": "nufus-75-001-150-000",
          "m2_kisi_metin": "0.5",
          "m2_kisi_binde": 500,
          "asgari_alan_metin": "1.500-3.000",
          "asgari_alan_m2_en_az": 1500,
          "asgari_alan_m2_en_cok": 3000
        },
        {
          "nufus_grubu": "nufus-150-001-500-000",
          "m2_kisi_metin": "0.6",
          "m2_kisi_binde": 600,
          "asgari_alan_metin": "1.500-3.000",
          "asgari_alan_m2_en_az": 1500,
          "asgari_alan_m2_en_cok": 3000
        },
        {
          "nufus_grubu": "nufus-501-000",
          "m2_kisi_metin": "0.6",
          "m2_kisi_binde": 600,
          "asgari_alan_metin": "2.000-4.000",
          "asgari_alan_m2_en_az": 2000,
          "asgari_alan_m2_en_cok": 4000
        }
      ]
    },
    {
      "id": "ek2-ilkokul",
      "ad": "İlkokul",
      "kaynak": "Mekânsal Planlar Yapım Yönetmeliği (MPYY), EK-2 (RG-17/5/2017-30069)",
      "ust_grup": "EĞİTİM TESİSLERİ ALANI",
      "satir": 6,
      "degerler": [
        {
          "nufus_grubu": "nufus-0-75-000",
          "m2_kisi_metin": "2",
          "m2_kisi_binde": 2000,
          "asgari_alan_metin": "5.000-8.000",
          "asgari_alan_m2_en_az": 5000,
          "asgari_alan_m2_en_cok": 8000
        },
        {
          "nufus_grubu": "nufus-75-001-150-000",
          "m2_kisi_metin": "2",
          "m2_kisi_binde": 2000,
          "asgari_alan_metin": "5.000-8.000",
          "asgari_alan_m2_en_az": 5000,
          "asgari_alan_m2_en_cok": 8000
        },
        {
          "nufus_grubu": "nufus-150-001-500-000",
          "m2_kisi_metin": "2",
          "m2_kisi_binde": 2000,
          "asgari_alan_metin": "5.000-8.000",
          "asgari_alan_m2_en_az": 5000,
          "asgari_alan_m2_en_cok": 8000
        },
        {
          "nufus_grubu": "nufus-501-000",
          "m2_kisi_metin": "2",
          "m2_kisi_binde": 2000,
          "asgari_alan_metin": "5.000-8.000",
          "asgari_alan_m2_en_az": 5000,
          "asgari_alan_m2_en_cok": 8000
        }
      ]
    },
    {
      "id": "ek2-ortaokul",
      "ad": "Ortaokul",
      "kaynak": "Mekânsal Planlar Yapım Yönetmeliği (MPYY), EK-2 (RG-17/5/2017-30069)",
      "ust_grup": "EĞİTİM TESİSLERİ ALANI",
      "satir": 7,
      "degerler": [
        {
          "nufus_grubu": "nufus-0-75-000",
          "m2_kisi_metin": "2",
          "m2_kisi_binde": 2000,
          "asgari_alan_metin": "6.000-10.000",
          "asgari_alan_m2_en_az": 6000,
          "asgari_alan_m2_en_cok": 10000
        },
        {
          "nufus_grubu": "nufus-75-001-150-000",
          "m2_kisi_metin": "2",
          "m2_kisi_binde": 2000,
          "asgari_alan_metin": "6.000-10.000",
          "asgari_alan_m2_en_az": 6000,
          "asgari_alan_m2_en_cok": 10000
        },
        {
          "nufus_grubu": "nufus-150-001-500-000",
          "m2_kisi_metin": "2",
          "m2_kisi_binde": 2000,
          "asgari_alan_metin": "6.000-10.000",
          "asgari_alan_m2_en_az": 6000,
          "asgari_alan_m2_en_cok": 10000
        },
        {
          "nufus_grubu": "nufus-501-000",
          "m2_kisi_metin": "2",
          "m2_kisi_binde": 2000,
          "asgari_alan_metin": "6.000-10.000",
          "asgari_alan_m2_en_az": 6000,
          "asgari_alan_m2_en_cok": 10000
        }
      ]
    },
    {
      "id": "ek2-gunduzlu-lise",
      "ad": "Gündüzlü Lise",
      "kaynak": "Mekânsal Planlar Yapım Yönetmeliği (MPYY), EK-2 (RG-17/5/2017-30069)",
      "ust_grup": "EĞİTİM TESİSLERİ ALANI",
      "satir": 8,
      "degerler": [
        {
          "nufus_grubu": "nufus-0-75-000",
          "m2_kisi_metin": "2",
          "m2_kisi_binde": 2000,
          "asgari_alan_metin": "6.000-10.000",
          "asgari_alan_m2_en_az": 6000,
          "asgari_alan_m2_en_cok": 10000
        },
        {
          "nufus_grubu": "nufus-75-001-150-000",
          "m2_kisi_metin": "2",
          "m2_kisi_binde": 2000,
          "asgari_alan_metin": "6.000-10.000",
          "asgari_alan_m2_en_az": 6000,
          "asgari_alan_m2_en_cok": 10000
        },
        {
          "nufus_grubu": "nufus-150-001-500-000",
          "m2_kisi_metin": "2.00",
          "m2_kisi_binde": 2000,
          "asgari_alan_metin": "6.000-10.000",
          "asgari_alan_m2_en_az": 6000,
          "asgari_alan_m2_en_cok": 10000
        },
        {
          "nufus_grubu": "nufus-501-000",
          "m2_kisi_metin": "2.00",
          "m2_kisi_binde": 2000,
          "asgari_alan_metin": "6.000-10.000",
          "asgari_alan_m2_en_az": 6000,
          "asgari_alan_m2_en_cok": 10000
        }
      ]
    },
    {
      "id": "ek2-yatili-lise",
      "ad": "Yatılı Lise",
      "kaynak": "Mekânsal Planlar Yapım Yönetmeliği (MPYY), EK-2 (RG-17/5/2017-30069)",
      "ust_grup": "EĞİTİM TESİSLERİ ALANI",
      "satir": 9,
      "degerler": [
        {
          "nufus_grubu": "nufus-0-75-000",
          "m2_kisi_metin": "2",
          "m2_kisi_binde": 2000,
          "m2_kisi_birlesik_hucre": "D8",
          "asgari_alan_metin": "10.000-15.000",
          "asgari_alan_m2_en_az": 10000,
          "asgari_alan_m2_en_cok": 15000
        },
        {
          "nufus_grubu": "nufus-75-001-150-000",
          "m2_kisi_metin": "2",
          "m2_kisi_binde": 2000,
          "m2_kisi_birlesik_hucre": "F8",
          "asgari_alan_metin": "10.000-15.000",
          "asgari_alan_m2_en_az": 10000,
          "asgari_alan_m2_en_cok": 15000
        },
        {
          "nufus_grubu": "nufus-150-001-500-000",
          "m2_kisi_metin": "2.00",
          "m2_kisi_binde": 2000,
          "m2_kisi_birlesik_hucre": "H8",
          "asgari_alan_metin": "10.000-15.000",
          "asgari_alan_m2_en_az": 10000,
          "asgari_alan_m2_en_cok": 15000
        },
        {
          "nufus_grubu": "nufus-501-000",
          "m2_kisi_metin": "2.00",
          "m2_kisi_binde": 2000,
          "m2_kisi_birlesik_hucre": "J8",
          "asgari_alan_metin": "10.000-15.000",
          "asgari_alan_m2_en_az": 10000,
          "asgari_alan_m2_en_cok": 15000
        }
      ]
    },
    {
      "id": "ek2-endustri-meslek-lisesi-cok-programli-lise",
      "ad": "Endüstri Meslek Lisesi, Çok Programlı Lise",
      "kaynak": "Mekânsal Planlar Yapım Yönetmeliği (MPYY), EK-2 (RG-17/5/2017-30069)",
      "ust_grup": "EĞİTİM TESİSLERİ ALANI",
      "satir": 10,
      "degerler": [
        {
          "nufus_grubu": "nufus-0-75-000",
          "m2_kisi_metin": "2",
          "m2_kisi_binde": 2000,
          "m2_kisi_birlesik_hucre": "D8",
          "asgari_alan_metin": "10.000-25.000",
          "asgari_alan_m2_en_az": 10000,
          "asgari_alan_m2_en_cok": 25000
        },
        {
          "nufus_grubu": "nufus-75-001-150-000",
          "m2_kisi_metin": "2",
          "m2_kisi_binde": 2000,
          "m2_kisi_birlesik_hucre": "F8",
          "asgari_alan_metin": "10.000-25.000",
          "asgari_alan_m2_en_az": 10000,
          "asgari_alan_m2_en_cok": 25000
        },
        {
          "nufus_grubu": "nufus-150-001-500-000",
          "m2_kisi_metin": "2.00",
          "m2_kisi_binde": 2000,
          "m2_kisi_birlesik_hucre": "H8",
          "asgari_alan_metin": "10.000-25.000",
          "asgari_alan_m2_en_az": 10000,
          "asgari_alan_m2_en_cok": 25000
        },
        {
          "nufus_grubu": "nufus-501-000",
          "m2_kisi_metin": "2.00",
          "m2_kisi_binde": 2000,
          "m2_kisi_birlesik_hucre": "J8",
          "asgari_alan_metin": "10.000-25.000",
          "asgari_alan_m2_en_az": 10000,
          "asgari_alan_m2_en_cok": 25000
        }
      ]
    },
    {